<?xml version="1.0" encoding="UTF-8"?> 
<PrismConstraints 
    xmlns="http://libhpc.doc.ic.ac.uk/prism/constraints"  
    xmlns:prism="http://libhpc.doc.ic.ac.uk/prism/constraints"
    xmlns:xsi="http://www.w3.org/2001/XMLSchema-instance"
    xsi:schemaLocation="http://libhpc.doc.ic.ac.uk/prism/constraints PRISMConstraints.xsd">
    
    <description>Constraints for the Nektar++ Incompressible Navier-Stokes Solver</description>
    
    <!-- This should be the solver name exactly as it appears in the root node
         of the tree that these constraints relate to. 
    -->
    <solver>IncompressibleNavierStokes</solver>
    
    <variables>
      <variable path="ProblemSpecification.Dimensions" name="Dimensions">
        <domain>
          <value>TwoDimensional</value>
          <value>ThreeDimensional</value>
        </domain>
      </variable>      

      <variable path="NumericalSpecification.SolverType" name="SolverType">
        <domain>
          <value>CoupledLinearNS</value>
          <value>VelocityCorrectionScheme</value>
        </domain>
      </variable>      

      <variable path="NumericalSpecification.SolverType.VelocityCorrectionScheme" name="VelocityCorrectionScheme">
        <domain>
          <value>Standard</value>
          <value>WeakPressure</value>
          <value>Mapping</value>
        </domain>
      </variable>      

      <variable path="NumericalSpecification.TimeIntegration.TimeIntegrationMethod" 
                name="TimeIntegrationMethod">
        <domain>
          <value>NotProvided</value>
          <value>IMEXOrder1</value>
          <value>IMEXOrder2</value>
          <value>IMEXOrder3</value>
          <value>DIRKOrder1</value>
          <value>ForwardEuler</value>
          <value>BackwardEuler</value>
          <value>ClassicalRungeKutta4</value>
          <value>BDFImplicitOrder1</value>
          <value>BDFImplicitOrder2</value>
        </domain>
      </variable>
      
      <variable path="NumericalSpecification.SimulationType" name="SimulationType">
        <domain>
          <value>DirectNumericalSimulation</value>
          <value>StabilityAnalysis</value>
          <value>SteadyStateStability</value>
        </domain>
      </variable>           

      <variable path="NumericalSpecification.SimulationType.DirectNumericalSimulation.Driver" name="Driver">
        <domain>
          <value>Adaptive</value>
          <value>Standard</value>
        </domain>
      </variable>           

      <variable path="NumericalSpecification.Projection" name="Projection">
        <domain>
          <value>ContinuousGalerkin</value>
          <value>DiscontinuousGalerkin</value>
          <value>MixedGalerkin</value>
        </domain>
      </variable>           

    </variables>
    
    <constraints>
      <!-- Mapping of driverType with mapping -->
      <mapping variable="Driver" varvalue="Adaptive" targetVariable="VelocityCorrectionScheme">
        <targetValue>Mapping</targetValue>
      </mapping>
      

      <!-- Mapping of solver type with time integration type -->
      <mapping variable="SolverType" varvalue="VelocityCorrectionScheme" targetVariable="TimeIntegrationMethod">
        <targetValue>IMEXOrder1</targetValue>
        <targetValue>IMEXOrder2</targetValue>
        <targetValue>IMEXOrder3</targetValue>
        <targetValue>DIRKOrder1</targetValue>
        <targetValue>ForwardEuler</targetValue>
        <targetValue>BackwardEuler</targetValue>
        <targetValue>ClassicalRungeKutta4</targetValue>
        <targetValue>BDFImplicitOrder1</targetValue>
        <targetValue>BDFImplicitOrder2</targetValue>
      </mapping>
      <mapping variable="SolverType" varvalue="CoupledLinearNS" targetVariable="TimeIntegrationMethod">
        <targetValue>NotProvided</targetValue>
      </mapping>

      <!-- Mapping of solver type with projection type -->
      <mapping variable="SolverType" varvalue="VelocityCorrectionScheme" targetVariable="Projection">
        <targetValue>ContinuousGalerkin</targetValue>
        <targetValue>DiscontinuousGalerkin</targetValue>
        <targetValue>MixedGalerkin</targetValue>
      </mapping>
      <mapping variable="SolverType" varvalue="CoupledLinearNS" targetVariable="Projection">
        <targetValue>ContinuousGalerkin</targetValue>
      </mapping>
      
    </constraints>              
                  
</PrismConstraints>